root@comp3134-Winter2025:~# tcpdump -n -i eth0
tcpdump: verbose output suppressed, use -v[v]... for full protocol decode
listening on eth0, link-type EN10MB (Ethernet), snapshot length 262144 bytes
02:01:50.592482 IP 68.183.207.237.22 > 142.189.208.5.63451: Flags [P.], seq 422535523:422535607, ack 1815927605, win 501, length 84
02:01:50.593691 IP 68.183.207.237.22 > 142.189.208.5.63451: Flags [P.], seq 84:192, ack 1, win 501, length 108
02:01:50.593762 IP 68.183.207.237.22 > 142.189.208.5.63451: Flags [P.], seq 192:228, ack 1, win 501, length 36
02:01:50.593812 IP 68.183.207.237.22 > 142.189.208.5.63451: Flags [P.], seq 228:280, ack 1, win 501, length 52
02:01:50.593857 IP 68.183.207.237.22 > 142.189.208.5.63451: Flags [P.], seq 280:348, ack 1, win 501, length 68
02:01:50.593920 IP 68.183.207.237.22 > 142.189.208.5.63451: Flags [P.], seq 348:416, ack 1, win 501, length 68
02:01:50.593941 IP 68.183.207.237.22 > 142.189.208.5.63451: Flags [P.], seq 416:452, ack 1, win 501, length 36
02:01:50.601569 IP 142.189.208.5.63451 > 68.183.207.237.22: Flags [.], ack 452, win 1024, length 0
02:01:50.691444 IP 68.183.207.237.22 > 142.189.208.5.63451: Flags [P.], seq 452:624, ack 1, win 501, length 172
02:01:50.691514 IP 68.183.207.237.22 > 142.189.208.5.63451: Flags [P.], seq 624:660, ack 1, win 501, length 36
02:01:50.691563 IP 68.183.207.237.22 > 142.189.208.5.63451: Flags [P.], seq 660:808, ack 1, win 501, length 148
02:01:50.691593 IP 68.183.207.237.22 > 142.189.208.5.63451: Flags [P.], seq 808:844, ack 1, win 501, length 36
02:01:50.691645 IP 68.183.207.237.22 > 142.189.208.5.63451: Flags [P.], seq 844:992, ack 1, win 501, length 148
02:01:50.691720 IP 68.183.207.237.22 > 142.189.208.5.63451: Flags [P.], seq 992:1176, ack 1, win 501, length 184
02:01:50.691781 IP 68.183.207.237.22 > 142.189.208.5.63451: Flags [P.], seq 1176:1360, ack 1, win 501, length 184
02:01:50.691803 IP 68.183.207.237.22 > 142.189.208.5.63451: Flags [P.], seq 1360:1396, ack 1, win 501, length 36
02:01:50.691856 IP 68.183.207.237.22 > 142.189.208.5.63451: Flags [P.], seq 1396:1544, ack 1, win 501, length 148
02:01:50.691887 IP 68.183.207.237.22 > 142.189.208.5.63451: Flags [P.], seq 1544:1580, ack 1, win 501, length 36
02:01:50.691928 IP 68.183.207.237.22 > 142.189.208.5.63451: Flags [P.], seq 1580:1728, ack 1, win 501, length 148
02:01:50.692249 IP 68.183.207.237.22 > 142.189.208.5.63451: Flags [P.], seq 1728:1896, ack 1, win 501, length 168
02:01:50.692335 IP 68.183.207.237.22 > 142.189.208.5.63451: Flags [P.], seq 1896:1932, ack 1, win 501, length 36
02:01:50.701916 IP 142.189.208.5.63451 > 68.183.207.237.22: Flags [.], ack 1896, win 1026, length 0
02:01:50.743980 IP 142.189.208.5.63451 > 68.183.207.237.22: Flags [.], ack 1932, win 1026, length 0
02:01:50.795302 IP 68.183.207.237.22 > 142.189.208.5.63451: Flags [P.], seq 1932:2080, ack 1, win 501, length 148
02:01:50.795388 IP 68.183.207.237.22 > 142.189.208.5.63451: Flags [P.], seq 2080:2264, ack 1, win 501, length 184
02:01:50.795441 IP 68.183.207.237.22 > 142.189.208.5.63451: Flags [P.], seq 2264:2300, ack 1, win 501, length 36
02:01:50.795485 IP 68.183.207.237.22 > 142.189.208.5.63451: Flags [P.], seq 2300:2448, ack 1, win 501, length 148
02:01:50.795516 IP 68.183.207.237.22 > 142.189.208.5.63451: Flags [P.], seq 2448:2484, ack 1, win 501, length 36
02:01:50.795555 IP 68.183.207.237.22 > 142.189.208.5.63451: Flags [P.], seq 2484:2632, ack 1, win 501, length 148
02:01:50.795583 IP 68.183.207.237.22 > 142.189.208.5.63451: Flags [P.], seq 2632:2668, ack 1, win 501, length 36
02:01:50.795647 IP 68.183.207.237.22 > 142.189.208.5.63451: Flags [P.], seq 2668:2816, ack 1, win 501, length 148
02:01:50.795721 IP 68.183.207.237.22 > 142.189.208.5.63451: Flags [P.], seq 2816:3000, ack 1, win 501, length 184
02:01:50.795762 IP 68.183.207.237.22 > 142.189.208.5.63451: Flags [P.], seq 3000:3036, ack 1, win 501, length 36
02:01:50.795818 IP 68.183.207.237.22 > 142.189.208.5.63451: Flags [P.], seq 3036:3184, ack 1, win 501, length 148
02:01:50.795890 IP 68.183.207.237.22 > 142.189.208.5.63451: Flags [P.], seq 3184:3368, ack 1, win 501, length 184
02:01:50.795928 IP 68.183.207.237.22 > 142.189.208.5.63451: Flags [P.], seq 3368:3404, ack 1, win 501, length 36
02:01:50.795977 IP 68.183.207.237.22 > 142.189.208.5.63451: Flags [P.], seq 3404:3552, ack 1, win 501, length 148
02:01:50.796193 IP 68.183.207.237.22 > 142.189.208.5.63451: Flags [P.], seq 3552:3588, ack 1, win 501, length 36
02:01:50.796308 IP 68.183.207.237.22 > 142.189.208.5.63451: Flags [P.], seq 3588:3736, ack 1, win 501, length 148
02:01:50.796345 IP 68.183.207.237.22 > 142.189.208.5.63451: Flags [P.], seq 3736:3772, ack 1, win 501, length 36
02:01:50.796386 IP 68.183.207.237.22 > 142.189.208.5.63451: Flags [P.], seq 3772:3920, ack 1, win 501, length 148
02:01:50.796413 IP 68.183.207.237.22 > 142.189.208.5.63451: Flags [P.], seq 3920:3956, ack 1, win 501, length 36
02:01:50.796450 IP 68.183.207.237.22 > 142.189.208.5.63451: Flags [P.], seq 3956:4104, ack 1, win 501, length 148
02:01:50.796478 IP 68.183.207.237.22 > 142.189.208.5.63451: Flags [P.], seq 4104:4140, ack 1, win 501, length 36
02:01:50.796513 IP 68.183.207.237.22 > 142.189.208.5.63451: Flags [P.], seq 4140:4288, ack 1, win 501, length 148
02:01:50.796552 IP 68.183.207.237.22 > 142.189.208.5.63451: Flags [P.], seq 4288:4324, ack 1, win 501, length 36
02:01:50.796605 IP 68.183.207.237.22 > 142.189.208.5.63451: Flags [P.], seq 4324:4464, ack 1, win 501, length 140
02:01:50.796645 IP 68.183.207.237.22 > 142.189.208.5.63451: Flags [P.], seq 4464:4500, ack 1, win 501, length 36
02:01:50.796695 IP 68.183.207.237.22 > 142.189.208.5.63451: Flags [P.], seq 4500:4640, ack 1, win 501, length 140
02:01:50.796724 IP 68.183.207.237.22 > 142.189.208.5.63451: Flags [P.], seq 4640:4676, ack 1, win 501, length 36
02:01:50.806928 IP 142.189.208.5.63451 > 68.183.207.237.22: Flags [.], ack 1932, win 1026, options [nop,nop,sack 1 {2080:2264}], length 0
02:01:50.808587 IP 142.189.208.5.63451 > 68.183.207.237.22: Flags [.], ack 1932, win 1026, options [nop,nop,sack 1 {2080:2300}], length 0
02:01:50.808587 IP 142.189.208.5.63451 > 68.183.207.237.22: Flags [.], ack 2300, win 1025, length 0
02:01:50.808587 IP 142.189.208.5.63451 > 68.183.207.237.22: Flags [.], ack 4640, win 1026, length 0
02:01:50.808588 IP 142.189.208.5.63451 > 68.183.207.237.22: Flags [.], ack 4676, win 1026, length 0
02:01:50.899328 IP 68.183.207.237.22 > 142.189.208.5.63451: Flags [P.], seq 4676:4824, ack 1, win 501, length 148
02:01:50.899406 IP 68.183.207.237.22 > 142.189.208.5.63451: Flags [P.], seq 4824:5008, ack 1, win 501, length 184
02:01:50.899479 IP 68.183.207.237.22 > 142.189.208.5.63451: Flags [P.], seq 5008:5192, ack 1, win 501, length 184
02:01:50.899499 IP 68.183.207.237.22 > 142.189.208.5.63451: Flags [P.], seq 5192:5228, ack 1, win 501, length 36
02:01:50.899538 IP 68.183.207.237.22 > 142.189.208.5.63451: Flags [P.], seq 5228:5376, ack 1, win 501, length 148
02:01:50.899588 IP 68.183.207.237.22 > 142.189.208.5.63451: Flags [P.], seq 5376:5412, ack 1, win 501, length 36
02:01:50.899642 IP 68.183.207.237.22 > 142.189.208.5.63451: Flags [P.], seq 5412:5560, ack 1, win 501, length 148
02:01:50.899673 IP 68.183.207.237.22 > 142.189.208.5.63451: Flags [P.], seq 5560:5596, ack 1, win 501, length 36
02:01:50.899715 IP 68.183.207.237.22 > 142.189.208.5.63451: Flags [P.], seq 5596:5744, ack 1, win 501, length 148
02:01:50.899745 IP 68.183.207.237.22 > 142.189.208.5.63451: Flags [P.], seq 5744:5780, ack 1, win 501, length 36
02:01:50.899788 IP 68.183.207.237.22 > 142.189.208.5.63451: Flags [P.], seq 5780:5928, ack 1, win 501, length 148
02:01:50.899817 IP 68.183.207.237.22 > 142.189.208.5.63451: Flags [P.], seq 5928:5964, ack 1, win 501, length 36
02:01:50.899856 IP 68.183.207.237.22 > 142.189.208.5.63451: Flags [P.], seq 5964:6112, ack 1, win 501, length 148
02:01:50.899897 IP 68.183.207.237.22 > 142.189.208.5.63451: Flags [P.], seq 6112:6148, ack 1, win 501, length 36
02:01:50.899955 IP 68.183.207.237.22 > 142.189.208.5.63451: Flags [P.], seq 6148:6296, ack 1, win 501, length 148
02:01:50.900003 IP 68.183.207.237.22 > 142.189.208.5.63451: Flags [P.], seq 6296:6332, ack 1, win 501, length 36
02:01:50.900287 IP 68.183.207.237.22 > 142.189.208.5.63451: Flags [P.], seq 6332:6480, ack 1, win 501, length 148
02:01:50.900333 IP 68.183.207.237.22 > 142.189.208.5.63451: Flags [P.], seq 6480:6516, ack 1, win 501, length 36
02:01:50.900393 IP 68.183.207.237.22 > 142.189.208.5.63451: Flags [P.], seq 6516:6664, ack 1, win 501, length 148
02:01:50.900451 IP 68.183.207.237.22 > 142.189.208.5.63451: Flags [P.], seq 6664:6848, ack 1, win 501, length 184
02:01:50.900472 IP 68.183.207.237.22 > 142.189.208.5.63451: Flags [P.], seq 6848:6884, ack 1, win 501, length 36
02:01:50.900528 IP 68.183.207.237.22 > 142.189.208.5.63451: Flags [P.], seq 6884:7032, ack 1, win 501, length 148
02:01:50.900563 IP 68.183.207.237.22 > 142.189.208.5.63451: Flags [P.], seq 7032:7068, ack 1, win 501, length 36
02:01:50.900611 IP 68.183.207.237.22 > 142.189.208.5.63451: Flags [P.], seq 7068:7216, ack 1, win 501, length 148
02:01:50.900654 IP 68.183.207.237.22 > 142.189.208.5.63451: Flags [P.], seq 7216:7252, ack 1, win 501, length 36
02:01:50.900705 IP 68.183.207.237.22 > 142.189.208.5.63451: Flags [P.], seq 7252:7400, ack 1, win 501, length 148
02:01:50.900780 IP 68.183.207.237.22 > 142.189.208.5.63451: Flags [P.], seq 7400:7584, ack 1, win 501, length 184
02:01:50.900825 IP 68.183.207.237.22 > 142.189.208.5.63451: Flags [P.], seq 7584:7620, ack 1, win 501, length 36
02:01:50.900878 IP 68.183.207.237.22 > 142.189.208.5.63451: Flags [P.], seq 7620:7768, ack 1, win 501, length 148
02:01:50.900926 IP 68.183.207.237.22 > 142.189.208.5.63451: Flags [P.], seq 7768:7804, ack 1, win 501, length 36
02:01:50.900961 IP 68.183.207.237.22 > 142.189.208.5.63451: Flags [P.], seq 7804:7952, ack 1, win 501, length 148
02:01:50.901032 IP 68.183.207.237.22 > 142.189.208.5.63451: Flags [P.], seq 7952:8136, ack 1, win 501, length 184
02:01:50.901082 IP 68.183.207.237.22 > 142.189.208.5.63451: Flags [P.], seq 8136:8320, ack 1, win 501, length 184
02:01:50.901105 IP 68.183.207.237.22 > 142.189.208.5.63451: Flags [P.], seq 8320:8356, ack 1, win 501, length 36
02:01:50.901141 IP 68.183.207.237.22 > 142.189.208.5.63451: Flags [P.], seq 8356:8504, ack 1, win 501, length 148
02:01:50.901190 IP 68.183.207.237.22 > 142.189.208.5.63451: Flags [P.], seq 8504:8688, ack 1, win 501, length 184
02:01:50.901308 IP 68.183.207.237.22 > 142.189.208.5.63451: Flags [P.], seq 8688:9092, ack 1, win 501, length 404
02:01:50.901345 IP 68.183.207.237.22 > 142.189.208.5.63451: Flags [P.], seq 9092:9240, ack 1, win 501, length 148
02:01:50.901376 IP 68.183.207.237.22 > 142.189.208.5.63451: Flags [P.], seq 9240:9276, ack 1, win 501, length 36
02:01:50.901414 IP 68.183.207.237.22 > 142.189.208.5.63451: Flags [P.], seq 9276:9424, ack 1, win 501, length 148
02:01:50.901444 IP 68.183.207.237.22 > 142.189.208.5.63451: Flags [P.], seq 9424:9460, ack 1, win 501, length 36
02:01:50.901480 IP 68.183.207.237.22 > 142.189.208.5.63451: Flags [P.], seq 9460:9608, ack 1, win 501, length 148
02:01:50.901598 IP 68.183.207.237.22 > 142.189.208.5.63451: Flags [P.], seq 9608:9816, ack 1, win 501, length 208
02:01:50.904461 IP 68.183.207.237.22 > 142.189.208.5.63451: Flags [P.], seq 9816:10588, ack 1, win 501, length 772
02:01:50.907622 IP 142.189.208.5.63451 > 68.183.207.237.22: Flags [.], ack 7252, win 1026, length 0
02:01:50.911264 IP 142.189.208.5.63451 > 68.183.207.237.22: Flags [.], ack 9460, win 1026, length 0
02:01:50.911264 IP 142.189.208.5.63451 > 68.183.207.237.22: Flags [.], ack 10588, win 1022, length 0
02:01:51.003341 IP 68.183.207.237.22 > 142.189.208.5.63451: Flags [P.], seq 10588:10736, ack 1, win 501, length 148
02:01:51.003415 IP 68.183.207.237.22 > 142.189.208.5.63451: Flags [P.], seq 10736:10920, ack 1, win 501, length 184
02:01:51.003464 IP 68.183.207.237.22 > 142.189.208.5.63451: Flags [P.], seq 10920:10956, ack 1, win 501, length 36
02:01:51.003493 IP 68.183.207.237.22 > 142.189.208.5.63451: Flags [P.], seq 10956:11104, ack 1, win 501, length 148
02:01:51.003519 IP 68.183.207.237.22 > 142.189.208.5.63451: Flags [P.], seq 11104:11140, ack 1, win 501, length 36
02:01:51.003556 IP 68.183.207.237.22 > 142.189.208.5.63451: Flags [P.], seq 11140:11288, ack 1, win 501, length 148
02:01:51.003583 IP 68.183.207.237.22 > 142.189.208.5.63451: Flags [P.], seq 11288:11324, ack 1, win 501, length 36
02:01:51.003618 IP 68.183.207.237.22 > 142.189.208.5.63451: Flags [P.], seq 11324:11472, ack 1, win 501, length 148
02:01:51.003679 IP 68.183.207.237.22 > 142.189.208.5.63451: Flags [P.], seq 11472:11656, ack 1, win 501, length 184
02:01:51.003722 IP 68.183.207.237.22 > 142.189.208.5.63451: Flags [P.], seq 11656:11692, ack 1, win 501, length 36
02:01:51.003773 IP 68.183.207.237.22 > 142.189.208.5.63451: Flags [P.], seq 11692:11840, ack 1, win 501, length 148
02:01:51.003806 IP 68.183.207.237.22 > 142.189.208.5.63451: Flags [P.], seq 11840:11876, ack 1, win 501, length 36
02:01:51.003845 IP 68.183.207.237.22 > 142.189.208.5.63451: Flags [P.], seq 11876:12024, ack 1, win 501, length 148
02:01:51.003898 IP 68.183.207.237.22 > 142.189.208.5.63451: Flags [P.], seq 12024:12208, ack 1, win 501, length 184
02:01:51.003931 IP 68.183.207.237.22 > 142.189.208.5.63451: Flags [P.], seq 12208:12244, ack 1, win 501, length 36
02:01:51.003965 IP 68.183.207.237.22 > 142.189.208.5.63451: Flags [P.], seq 12244:12392, ack 1, win 501, length 148
02:01:51.003993 IP 68.183.207.237.22 > 142.189.208.5.63451: Flags [P.], seq 12392:12428, ack 1, win 501, length 36
02:01:51.004201 IP 68.183.207.237.22 > 142.189.208.5.63451: Flags [P.], seq 12428:12576, ack 1, win 501, length 148
02:01:51.004280 IP 68.183.207.237.22 > 142.189.208.5.63451: Flags [P.], seq 12576:12760, ack 1, win 501, length 184
02:01:51.004315 IP 68.183.207.237.22 > 142.189.208.5.63451: Flags [P.], seq 12760:12796, ack 1, win 501, length 36
02:01:51.004343 IP 68.183.207.237.22 > 142.189.208.5.63451: Flags [P.], seq 12796:12944, ack 1, win 501, length 148
02:01:51.004370 IP 68.183.207.237.22 > 142.189.208.5.63451: Flags [P.], seq 12944:12980, ack 1, win 501, length 36
02:01:51.004406 IP 68.183.207.237.22 > 142.189.208.5.63451: Flags [P.], seq 12980:13128, ack 1, win 501, length 148
02:01:51.004433 IP 68.183.207.237.22 > 142.189.208.5.63451: Flags [P.], seq 13128:13164, ack 1, win 501, length 36
02:01:51.004468 IP 68.183.207.237.22 > 142.189.208.5.63451: Flags [P.], seq 13164:13312, ack 1, win 501, length 148
02:01:51.004496 IP 68.183.207.237.22 > 142.189.208.5.63451: Flags [P.], seq 13312:13348, ack 1, win 501, length 36
02:01:51.004532 IP 68.183.207.237.22 > 142.189.208.5.63451: Flags [P.], seq 13348:13496, ack 1, win 501, length 148
02:01:51.004567 IP 68.183.207.237.22 > 142.189.208.5.63451: Flags [P.], seq 13496:13532, ack 1, win 501, length 36
02:01:51.004600 IP 68.183.207.237.22 > 142.189.208.5.63451: Flags [P.], seq 13532:13680, ack 1, win 501, length 148
02:01:51.004629 IP 68.183.207.237.22 > 142.189.208.5.63451: Flags [P.], seq 13680:13716, ack 1, win 501, length 36
02:01:51.004679 IP 68.183.207.237.22 > 142.189.208.5.63451: Flags [P.], seq 13716:13864, ack 1, win 501, length 148
02:01:51.004705 IP 68.183.207.237.22 > 142.189.208.5.63451: Flags [P.], seq 13864:13900, ack 1, win 501, length 36
02:01:51.004742 IP 68.183.207.237.22 > 142.189.208.5.63451: Flags [P.], seq 13900:14048, ack 1, win 501, length 148
02:01:51.004769 IP 68.183.207.237.22 > 142.189.208.5.63451: Flags [P.], seq 14048:14084, ack 1, win 501, length 36
02:01:51.004825 IP 68.183.207.237.22 > 142.189.208.5.63451: Flags [P.], seq 14084:14232, ack 1, win 501, length 148
02:01:51.004862 IP 68.183.207.237.22 > 142.189.208.5.63451: Flags [P.], seq 14232:14268, ack 1, win 501, length 36
02:01:51.004901 IP 68.183.207.237.22 > 142.189.208.5.63451: Flags [P.], seq 14268:14416, ack 1, win 501, length 148
02:01:51.004939 IP 68.183.207.237.22 > 142.189.208.5.63451: Flags [P.], seq 14416:14452, ack 1, win 501, length 36
02:01:51.004994 IP 68.183.207.237.22 > 142.189.208.5.63451: Flags [P.], seq 14452:14600, ack 1, win 501, length 148
02:01:51.005033 IP 68.183.207.237.22 > 142.189.208.5.63451: Flags [P.], seq 14600:14636, ack 1, win 501, length 36
02:01:51.005073 IP 68.183.207.237.22 > 142.189.208.5.63451: Flags [P.], seq 14636:14784, ack 1, win 501, length 148
02:01:51.005101 IP 68.183.207.237.22 > 142.189.208.5.63451: Flags [P.], seq 14784:14820, ack 1, win 501, length 36
02:01:51.005139 IP 68.183.207.237.22 > 142.189.208.5.63451: Flags [P.], seq 14820:14968, ack 1, win 501, length 148
02:01:51.005196 IP 68.183.207.237.22 > 142.189.208.5.63451: Flags [P.], seq 14968:15152, ack 1, win 501, length 184
02:01:51.005224 IP 68.183.207.237.22 > 142.189.208.5.63451: Flags [P.], seq 15152:15188, ack 1, win 501, length 36
02:01:51.005277 IP 68.183.207.237.22 > 142.189.208.5.63451: Flags [P.], seq 15188:15336, ack 1, win 501, length 148
02:01:51.005317 IP 68.183.207.237.22 > 142.189.208.5.63451: Flags [P.], seq 15336:15372, ack 1, win 501, length 36
02:01:51.005370 IP 68.183.207.237.22 > 142.189.208.5.63451: Flags [P.], seq 15372:15520, ack 1, win 501, length 148
02:01:51.005428 IP 68.183.207.237.22 > 142.189.208.5.63451: Flags [P.], seq 15520:15556, ack 1, win 501, length 36
02:01:51.005463 IP 68.183.207.237.22 > 142.189.208.5.63451: Flags [P.], seq 15556:15704, ack 1, win 501, length 148
02:01:51.005505 IP 68.183.207.237.22 > 142.189.208.5.63451: Flags [P.], seq 15704:15740, ack 1, win 501, length 36
02:01:51.005551 IP 68.183.207.237.22 > 142.189.208.5.63451: Flags [P.], seq 15740:15888, ack 1, win 501, length 148
02:01:51.005599 IP 68.183.207.237.22 > 142.189.208.5.63451: Flags [P.], seq 15888:15924, ack 1, win 501, length 36
02:01:51.005628 IP 68.183.207.237.22 > 142.189.208.5.63451: Flags [P.], seq 15924:16072, ack 1, win 501, length 148
02:01:51.005654 IP 68.183.207.237.22 > 142.189.208.5.63451: Flags [P.], seq 16072:16108, ack 1, win 501, length 36
02:01:51.005691 IP 68.183.207.237.22 > 142.189.208.5.63451: Flags [P.], seq 16108:16256, ack 1, win 501, length 148
02:01:51.005718 IP 68.183.207.237.22 > 142.189.208.5.63451: Flags [P.], seq 16256:16292, ack 1, win 501, length 36
02:01:51.005754 IP 68.183.207.237.22 > 142.189.208.5.63451: Flags [P.], seq 16292:16440, ack 1, win 501, length 148
02:01:51.005829 IP 68.183.207.237.22 > 142.189.208.5.63451: Flags [P.], seq 16440:16708, ack 1, win 501, length 268
02:01:51.005852 IP 68.183.207.237.22 > 142.189.208.5.63451: Flags [P.], seq 16708:16976, ack 1, win 501, length 268
02:01:51.005932 IP 68.183.207.237.22 > 142.189.208.5.63451: Flags [P.], seq 16976:17476, ack 1, win 501, length 500
02:01:51.006012 IP 68.183.207.237.22 > 142.189.208.5.63451: Flags [P.], seq 17476:17856, ack 1, win 501, length 380
02:01:51.006073 IP 68.183.207.237.22 > 142.189.208.5.63451: Flags [P.], seq 17856:18212, ack 1, win 501, length 356
02:01:51.006121 IP 68.183.207.237.22 > 142.189.208.5.63451: Flags [P.], seq 18212:18352, ack 1, win 501, length 140
02:01:51.012615 IP 142.189.208.5.63451 > 68.183.207.237.22: Flags [.], ack 11472, win 1026, options [nop,nop,sack 1 {12980:13128}], length 0
02:01:51.013920 IP 142.189.208.5.63451 > 68.183.207.237.22: Flags [.], ack 11472, win 1026, options [nop,nop,sack 1 {12980:13164}], length 0
02:01:51.013921 IP 142.189.208.5.63451 > 68.183.207.237.22: Flags [.], ack 11472, win 1026, options [nop,nop,sack 1 {12980:13312}], length 0
02:01:51.013921 IP 142.189.208.5.63451 > 68.183.207.237.22: Flags [.], ack 11656, win 1025, options [nop,nop,sack 1 {12980:13312}], length 0
02:01:51.013921 IP 142.189.208.5.63451 > 68.183.207.237.22: Flags [.], ack 11692, win 1025, options [nop,nop,sack 1 {12980:13312}], length 0
02:01:51.013921 IP 142.189.208.5.63451 > 68.183.207.237.22: Flags [.], ack 11840, win 1025, options [nop,nop,sack 1 {12980:13312}], length 0
02:01:51.013921 IP 142.189.208.5.63451 > 68.183.207.237.22: Flags [.], ack 11876, win 1025, options [nop,nop,sack 1 {12980:13312}], length 0
02:01:51.013921 IP 142.189.208.5.63451 > 68.183.207.237.22: Flags [.], ack 12024, win 1024, options [nop,nop,sack 1 {12980:13312}], length 0
02:01:51.013921 IP 142.189.208.5.63451 > 68.183.207.237.22: Flags [.], ack 12208, win 1023, options [nop,nop,sack 1 {12980:13312}], length 0
02:01:51.014014 IP 142.189.208.5.63451 > 68.183.207.237.22: Flags [.], ack 12244, win 1023, options [nop,nop,sack 1 {12980:13312}], length 0
02:01:51.014014 IP 142.189.208.5.63451 > 68.183.207.237.22: Flags [.], ack 12392, win 1023, options [nop,nop,sack 1 {12980:13312}], length 0
02:01:51.015565 IP 142.189.208.5.63451 > 68.183.207.237.22: Flags [.], ack 12428, win 1022, options [nop,nop,sack 1 {12980:13312}], length 0
02:01:51.015565 IP 142.189.208.5.63451 > 68.183.207.237.22: Flags [.], ack 12576, win 1022, options [nop,nop,sack 1 {12980:13312}], length 0
02:01:51.015565 IP 142.189.208.5.63451 > 68.183.207.237.22: Flags [.], ack 12760, win 1021, options [nop,nop,sack 1 {12980:13312}], length 0
02:01:51.015565 IP 142.189.208.5.63451 > 68.183.207.237.22: Flags [.], ack 12796, win 1021, options [nop,nop,sack 1 {12980:13312}], length 0
02:01:51.015565 IP 142.189.208.5.63451 > 68.183.207.237.22: Flags [.], ack 12944, win 1026, options [nop,nop,sack 1 {12980:13312}], length 0
02:01:51.015626 IP 142.189.208.5.63451 > 68.183.207.237.22: Flags [.], ack 13312, win 1025, length 0
02:01:51.015626 IP 142.189.208.5.63451 > 68.183.207.237.22: Flags [.], ack 16292, win 1026, length 0
02:01:51.015626 IP 142.189.208.5.63451 > 68.183.207.237.22: Flags [.], ack 18352, win 1026, length 0
^C
185 packets captured
210 packets received by filter
0 packets dropped by kernel
