root@comp3134-Winter2025:~# tcpdump -c 5 -i eth0
tcpdump: verbose output suppressed, use -v[v]... for full protocol decode
listening on eth0, link-type EN10MB (Ethernet), snapshot length 262144 bytes
01:54:51.730500 IP comp3134-Winter2025.ssh > 142.189.208.5.63451: Flags [P.], seq 337224299:337224407, ack 1815881253, win 501, length 108
01:54:51.730579 IP comp3134-Winter2025.ssh > 142.189.208.5.63451: Flags [P.], seq 108:196, ack 1, win 501, length 88
01:54:51.730613 IP comp3134-Winter2025.ssh > 142.189.208.5.63451: Flags [P.], seq 196:264, ack 1, win 501, length 68
01:54:51.730644 IP comp3134-Winter2025.ssh > 142.189.208.5.63451: Flags [P.], seq 264:332, ack 1, win 501, length 68
01:54:51.730672 IP comp3134-Winter2025.ssh > 142.189.208.5.63451: Flags [P.], seq 332:368, ack 1, win 501, length 36
5 packets captured
58 packets received by filter
0 packets dropped by kernel

